{
  "schema_version": 1,
  "song_id": "lastpage",
  "mapping": [
    {
      "syllable_id": "s0001",
      "text": "雨",
      "line_index": 0,
      "occurrence": 1,
      "status": "mapped",
      "note_ids": [
        "n0002"
      ],
      "sustain_note_ids": [],
      "reason_code": "dp_monotonic_optimum",
      "margin": 1.9165,
      "evidence": {
        "syllable_id": "s0001",
        "anchor_s": 14.2008,
        "anchor_source": "hfa",
        "anchor_method": "sequence",
        "expected_dur_s": 0.3357
      }
    },
    {
      "syllable_id": "s0002",
      "text": "停",
      "line_index": 0,
      "occurrence": 1,
      "status": "mapped",
      "note_ids": [
        "n0003"
      ],
      "sustain_note_ids": [],
      "reason_code": "dp_monotonic_optimum",
      "margin": 1.7656,
      "evidence": {
        "syllable_id": "s0002",
        "anchor_s": 14.5365,
        "anchor_source": "hfa",
        "anchor_method": "sequence",
        "expected_dur_s": 0.4979
      }
    },
    {
      "syllable_id": "s0003",
      "text": "滞",
      "line_index": 0,
      "occurrence": 1,
      "status": "mapped",
      "note_ids": [
        "n0004"
      ],
      "sustain_note_ids": [],
      "reason_code": "dp_monotonic_optimum",
      "margin": 1.8779,
      "evidence": {
        "syllable_id": "s0003",
        "anchor_s": 15.0344,
        "anchor_source": "hfa",
        "anchor_method": "sequence",
        "expected_dur_s": 0.3498
      }
    },
    {
      "syllable_id": "s0004",
      "text": "天",
      "line_index": 0,
      "occurrence": 1,
      "status": "mapped",
      "note_ids": [
        "n0005"
      ],
      "sustain_note_ids": [],
      "reason_code": "dp_monotonic_optimum",
      "margin": 1.6953,
      "evidence": {
        "syllable_id": "s0004",
        "anchor_s": 15.3842,
        "anchor_source": "hfa",
        "anchor_method": "sequence",
        "expected_dur_s": 0.4755
      }
    },
    {
      "syllable_id": "s0005",
      "text": "空",
      "line_index": 0,
      "occurrence": 1,
      "status": "mapped",
      "note_ids": [
        "n0006"
      ],
      "sustain_note_ids": [],
      "reason_code": "dp_monotonic_optimum",
      "margin": 1.882,
      "evidence": {
        "syllable_id": "s0005",
        "anchor_s": 15.8597,
        "anchor_source": "hfa",
        "anchor_method": "sequence",
        "expected_dur_s": 0.3843
      }
    },
    {
      "syllable_id": "s0006",
      "text": "之",
      "line_index": 0,
      "occurrence": 1,
      "status": "mapped",
      "note_ids": [
        "n0007"
      ],
      "sustain_note_ids": [],
      "reason_code": "dp_monotonic_optimum",
      "margin": 1.8179,
      "evidence": {
        "syllable_id": "s0006",
        "anchor_s": 16.244,
        "anchor_source": "hfa",
        "anchor_method": "sequence",
        "expected_dur_s": 0.4061
      }
    },
    {
      "syllable_id": "s0007",
      "text": "间",
      "line_index": 0,
      "occurrence": 1,
      "status": "mapped",
      "note_ids": [
        "n0008"
      ],
      "sustain_note_ids": [],
      "reason_code": "dp_monotonic_optimum",
      "margin": 1.713,
      "evidence": {
        "syllable_id": "s0007",
        "anchor_s": 16.6501,
        "anchor_source": "hfa",
        "anchor_method": "sequence",
        "expected_dur_s": 0.7892
      }
    },
    {
      "syllable_id": "s0008",
      "text": "像",
      "line_index": 1,
      "occurrence": 1,
      "status": "mapped",
      "note_ids": [
        "n0009"
      ],
      "sustain_note_ids": [],
      "reason_code": "dp_monotonic_optimum",
      "margin": 1.9485,
      "evidence": {
        "syllable_id": "s0008",
        "anchor_s": 17.55,
        "anchor_source": "hfa",
        "anchor_method": "sequence",
        "expected_dur_s": 0.4286
      }
    },
    {
      "syllable_id": "s0009",
      "text": "泪",
      "line_index": 1,
      "occurrence": 1,
      "status": "mapped",
      "note_ids": [
        "n0010"
      ],
      "sustain_note_ids": [],
      "reason_code": "dp_monotonic_optimum",
      "margin": 1.9755,
      "evidence": {
        "syllable_id": "s0009",
        "anchor_s": 17.9786,
        "anchor_source": "hfa",
        "anchor_method": "sequence",
        "expected_dur_s": 0.4183
      }
    },
    {
      "syllable_id": "s0010",
      "text": "在",
      "line_index": 1,
      "occurrence": 1,
      "status": "mapped",
      "note_ids": [
        "n0011"
      ],
      "sustain_note_ids": [],
      "reason_code": "dp_monotonic_optimum",
      "margin": 1.8425,
      "evidence": {
        "syllable_id": "s0010",
        "anchor_s": 18.3969,
        "anchor_source": "hfa",
        "anchor_method": "sequence",
        "expected_dur_s": 0.3371
      }
    },
    {
      "syllable_id": "s0011",
      "text": "眼",
      "line_index": 1,
      "occurrence": 1,
      "status": "mapped",
      "note_ids": [
        "n0012"
      ],
      "sustain_note_ids": [],
      "reason_code": "dp_monotonic_optimum",
      "margin": 1.7467,
      "evidence": {
        "syllable_id": "s0011",
        "anchor_s": 18.734,
        "anchor_source": "hfa",
        "anchor_method": "sequence",
        "expected_dur_s": 0.4852
      }
    },
    {
      "syllable_id": "s0012",
      "text": "眶",
      "line_index": 1,
      "occurrence": 1,
      "status": "mapped",
      "note_ids": [
        "n0013"
      ],
      "sustain_note_ids": [],
      "reason_code": "dp_monotonic_optimum",
      "margin": 1.5497,
      "evidence": {
        "syllable_id": "s0012",
        "anchor_s": 19.2192,
        "anchor_source": "hfa",
        "anchor_method": "sequence",
        "expected_dur_s": 0.4073
      }
    },
    {
      "syllable_id": "s0013",
      "text": "盘",
      "line_index": 1,
      "occurrence": 1,
      "status": "mapped",
      "note_ids": [
        "n0014"
      ],
      "sustain_note_ids": [],
      "reason_code": "dp_monotonic_optimum",
      "margin": 1.0971,
      "evidence": {
        "syllable_id": "s0013",
        "anchor_s": 19.6265,
        "anchor_source": "hfa",
        "anchor_method": "sequence",
        "expected_dur_s": 0.3597
      }
    },
    {
      "syllable_id": "s0014",
      "text": "旋",
      "line_index": 1,
      "occurrence": 1,
      "status": "mapped",
      "note_ids": [
        "n0015",
        "n0016"
      ],
      "sustain_note_ids": [
        "n0016"
      ],
      "reason_code": "dp_monotonic_optimum",
      "margin": 0.97,
      "evidence": {
        "syllable_id": "s0014",
        "anchor_s": 19.9862,
        "anchor_source": "hfa",
        "anchor_method": "sequence",
        "expected_dur_s": 0.652
      }
    },
    {
      "syllable_id": "s0015",
      "text": "这",
      "line_index": 2,
      "occurrence": 1,
      "status": "mapped",
      "note_ids": [
        "n0018"
      ],
      "sustain_note_ids": [],
      "reason_code": "dp_monotonic_optimum",
      "margin": 1.4558,
      "evidence": {
        "syllable_id": "s0015",
        "anchor_s": 21.03,
        "anchor_source": "hfa",
        "anchor_method": "sequence",
        "expected_dur_s": 0.0922
      }
    },
    {
      "syllable_id": "s0016",
      "text": "也",
      "line_index": 2,
      "occurrence": 1,
      "status": "mapped",
      "note_ids": [
        "n0019"
      ],
      "sustain_note_ids": [],
      "reason_code": "dp_monotonic_optimum",
      "margin": 1.7651,
      "evidence": {
        "syllable_id": "s0016",
        "anchor_s": 21.4012,
        "anchor_source": "hfa",
        "anchor_method": "sequence",
        "expected_dur_s": 0.3808
      }
    },
    {
      "syllable_id": "s0017",
      "text": "许",
      "line_index": 2,
      "occurrence": 1,
      "status": "mapped",
      "note_ids": [
        "n0020"
      ],
      "sustain_note_ids": [],
      "reason_code": "dp_monotonic_optimum",
      "margin": 1.7373,
      "evidence": {
        "syllable_id": "s0017",
        "anchor_s": 21.782,
        "anchor_source": "hfa",
        "anchor_method": "sequence",
        "expected_dur_s": 0.4172
      }
    },
    {
      "syllable_id": "s0018",
      "text": "是",
      "line_index": 2,
      "occurrence": 1,
      "status": "mapped",
      "note_ids": [
        "n0021"
      ],
      "sustain_note_ids": [],
      "reason_code": "dp_monotonic_optimum",
      "margin": 1.5221,
      "evidence": {
        "syllable_id": "s0018",
        "anchor_s": 22.1992,
        "anchor_source": "hfa",
        "anchor_method": "sequence",
        "expected_dur_s": 0.5121
      }
    },
    {
      "syllable_id": "s0019",
      "text": "最",
      "line_index": 2,
      "occurrence": 1,
      "status": "mapped",
      "note_ids": [
        "n0022"
      ],
      "sustain_note_ids": [],
      "reason_code": "dp_monotonic_optimum",
      "margin": 1.9248,
      "evidence": {
        "syllable_id": "s0019",
        "anchor_s": 22.7113,
        "anchor_source": "hfa",
        "anchor_method": "sequence",
        "expected_dur_s": 0.3834
      }
    },
    {
      "syllable_id": "s0020",
      "text": "后",
      "line_index": 2,
      "occurrence": 1,
      "status": "mapped",
      "note_ids": [
        "n0023"
      ],
      "sustain_note_ids": [],
      "reason_code": "dp_monotonic_optimum",
      "margin": 1.7783,
      "evidence": {
        "syllable_id": "s0020",
        "anchor_s": 23.0947,
        "anchor_source": "hfa",
        "anchor_method": "sequence",
        "expected_dur_s": 0.5233
      }
    },
    {
      "syllable_id": "s0021",
      "text": "一",
      "line_index": 2,
      "occurrence": 1,